,x
1, 단독 국민연금 후보자 히든카드 박천석 새마을금고 
2, 민주당 온라인 청원에 비명계 출당 촉구 줄이어 
3, 文 도 넘지 마라 경고에 野 전적 공감 與 자백하나 
4, 불법 파업은 재난 전면전 선포한 尹 정부 파국 기로에 선 노 정 
5, 文 서해 수사 도 넘지 말라 경고에 이재명 전적으로 공감 
6, 단독 삼성전자 퇴직 임원 대거 통보 뉴삼성 임원 줄인다 
7, 윤 대통령 주한중국대사관 장쩌민 전 中 주석 분향소 조문 
8, 토요일 수도권에 비 눈온다 일요일부턴 다시 강추위 
9, 매각설에 주가 치솟는 제주은행 신한금융 검토한 바 없어 
10, 단독 핵연료 재활용 불씨 살렸다 파이로 명문화한다 
11, 택시기사도 손님도 심야할증 부담 우려 피크타임대 이용객 줄 수도 
12, 비알코올성 지방간 관리 체중감량 이 최우선 인터뷰 
13, 여야 예산부수법안 검토 마쳐 종부세 등 쟁점 논의 계속 
14, 일본기업 탈중국 공급망 구축 늘어 대만 제로코로나 리스크 커 
15, 美 요란한 해고 의 시대 최대 피해자는 화이트칼라 정규직 
16, 中 거국적 애도 분위기 만들며 방역완화 백지시위 내주 기로 
17, 정부 5일부터 화물차주 제재 착수 압박 수위 높인다 종합 
18, 추가 업무개시명령 형사처벌 정부 화물연대 압박수위 올린다 종합 
19, 끝없는 추락 글로벌 컨테이너 운임 24주 연속 하락 
20, 화물연대 파업에 멈춘 사업 신안산선도 사정권 
21, 뉴스큐 기로에 선 文 인사들 묵묵부답 서훈의 운명은 
22, 안전운임제 안 다루던 언론 화물연대 파업엔 비난 
23, 150만원짜리 이불 누가 살까 했는데 주 고객이 20대 한경제의 신선한 경제 
24, 저녁잇슈 2022년 12월 2일 금요일 
25, 뉴스외전 정치 맞수다 예산안 처리는 어느 쪽이 미루고 있나 팩트체크 
26, 지금은 우주 아르테미스 마침내 지구로 향하다 
27, 예상 깨고 4나노 반도체 생산 삼성의 대응 전략은 정지은의 산업노트 
28, 올댓차이나 대만 증시 이익매물로 4일 만에 0 28 반락 마감 
29, 혹등고래가 사람에게 다가온 동화 같은 순간 이유는 
30,마크롱 연설 듣는 조 바이든 美 대통령
31,한자리에 모인 전국법원장들 
32,주호영 박홍근 회동 해임건의안 예산안 줄다리기 지속 
